{
  "$schema": "../../implementations/ImplementationTracker.schema.json",
  "metadata": {
    "document_id": "implementation_tracker_02.json",
    "title": "Implementation 02 Tracker",
    "purpose": "This file tracks an implementation plan.",
    "source_format": "json",
    "document_authority": "operational_state"
  },
  "status": "",
  "state": "proposed",
  "tracker": [
    {
      "date": "20260615",
      "seam": "01",
      "agent": "Project Authority",
      "change": "Archive record schema",
      "evidence": "evidence of completion",
      "status": "complete"
    },
    {
      "date": "20260615",
      "seam": "20",
      "agent": "Project Authority",
      "change": "Artifact classification",
      "evidence": "new classifications in governance primitives json.",
      "status": "complete"
    },
    {
      "date": "20260615",
      "seam": "03",
      "agent": "Codex",
      "change": "PM coverage disposition",
      "evidence": "PASS: python -m unittest -v tests.test_governance_primitives tests.test_project_manager_report_validation tests.test_project_manager_report_extractor tests.test_project_manager_report_validation_artifact tests.test_static_context_packet_compiler tests.test_openai_response_payload_compiler tests.test_package_route (86 tests); PASS: python -m unittest discover -s tests -v (173 tests); tracked PM report and governance taxonomy validate via JSON Schema and Pydantic; basis remains opaque free text with no semantic parsing.",
      "status": "complete"
    },
    {
      "date": "20260615",
      "seam": "04",
      "agent": "Project Authority",
      "change": "PM prose migration",
      "evidence": "Completion of seam 03 and reduction of prose in project_manager.agent.json",
      "status": "complete"
    },
    {
      "date": "20260615",
      "seam": "05",
      "agent": "Project Authority",
      "change": "AM creation",
      "evidence": "archive_manager.agent.json, archive_manager_agent.py, ArchiveManagerAgent.schema.json, archive_manager_report.example.json, archive_manager_report.py, ArchiveManagerReport.schema.json complete and functional for live API call.",
      "status": "complete"
    }
  ],
  "blockers": [
    {
      "blocker": "",
      "boundary": "",
      "owner_agent": "",
      "resolution": ""
    }
  ],
  "closeout_notes": [
    "When this bundle completes, move it from ./active/ to ./archive/."
  ]
}
